{
  "$schema": "https://json-schema.org/draft/2020-12/schema",
  "title": "Publicaciones locales de anatod",
  "description": "Lista de posts. Ordenar por date de más reciente a más antiguo. Las URLs se calculan como /blog/AAAA/MM/DD/slug/ usando date y slug. No requiere IDs ni una base de datos.",
  "type": "array",
  "items": {
    "type": "object",
    "additionalProperties": false,
    "required": [
      "id",
      "slug",
      "title",
      "date",
      "excerpt",
      "content_html",
      "image"
    ],
    "properties": {
      "slug": {
        "type": "string",
        "minLength": 1,
        "description": "Identificador único. Conservar exactamente los slugs importados, incluyendo secuencias %xx. Para nuevos posts usar minúsculas, números y guiones."
      },
      "title": {
        "type": "string",
        "minLength": 1,
        "description": "Título en texto plano, sin etiquetas HTML."
      },
      "date": {
        "type": "string",
        "format": "date",
        "pattern": "^[0-9]{4}-[0-9]{2}-[0-9]{2}$",
        "description": "Fecha de publicación en formato AAAA-MM-DD, sin hora."
      },
      "excerpt": {
        "type": "string",
        "description": "Resumen en texto plano para las tarjetas y la introducción del artículo."
      },
      "content_html": {
        "type": "string",
        "minLength": 1,
        "description": "Cuerpo completo en HTML. Las imágenes importadas usan rutas locales bajo /assets/img/blog/."
      },
      "image": {
        "type": "object",
        "additionalProperties": false,
        "required": [
          "url",
          "alt"
        ],
        "properties": {
          "url": {
            "type": "string",
            "format": "uri-reference",
            "pattern": "^(/assets/img/|https?://[^/]+/)",
            "description": "Ruta de la imagen destacada. Las imágenes importadas están en /assets/img/blog/. Para nuevos posts puedes agregar una imagen al proyecto y usar su ruta local."
          },
          "alt": {
            "type": "string",
            "description": "Texto alternativo de la imagen."
          }
        }
      },
      "id": {
        "type": "integer",
        "minimum": 1,
        "description": "Identificador estable de la publicación y sus traducciones. No modificar al cambiar el título, la fecha o el slug. Asignar un ID nuevo y único a cada publicación."
      }
    }
  }
}
