[{"slug":"nos-vemos-en-acutelan-2026","title":"Nos vemos en ACUTELAN 2026","date":"2026-09-07","excerpt":"Este 18 y 19 de noviembre estaremos en ACUTELAN 2026, en Granada. Te esperamos para compartir las últimas novedades de anatod, nuestras nuevas integraciones y todo lo que estamos preparando para los operadores de telecomunicaciones. 🚀","content_html":"\n<p class=\"wp-block-paragraph\">Este <strong>18 y 19 de noviembre</strong> estaremos presentes en la <strong>41ª Feria Tecnológica de ACUTELAN</strong>, el mayor punto de encuentro para operadores de telecomunicaciones, infraestructuras y televisiones locales de España, que se celebrará en <strong>FERMASA, Armilla (Granada)</strong>.</p>\n\n\n\n<p class=\"wp-block-paragraph\">Para nosotros, estos eventos son mucho más que una feria. Son la oportunidad de reencontrarnos con clientes, partners y profesionales del sector, compartir ideas, conocer nuevos proyectos y seguir construyendo relaciones que impulsan el crecimiento de los operadores.</p>\n\n\n\n<p class=\"wp-block-paragraph\">Durante la feria vamos a presentar las últimas novedades de <strong>anatod</strong> ® , nuestras nuevas integraciones y las mejoras que seguimos incorporando para ayudar a los ISP a gestionar su operación con mayor eficiencia, seguridad y capacidad de integración.</p>\n\n\n\n<p class=\"wp-block-paragraph\">Si vas a estar en Granada, nos encantaría saludarte, conversar sobre tus proyectos y mostrarte hacia dónde estamos llevando nuestra plataforma.</p>\n\n\n\n<p class=\"wp-block-paragraph\"><strong>¡Nos vemos en ACUTELAN 2026!</strong> 🚀</p>\n","image":{"url":"/assets/img/blog/2026/09/feria_acutelan.jpg","alt":"feria_acutelan_2026"},"id":100083},{"slug":"seguimos-integrando-herramientas-para-una-mejor-gestion-de-redes-ahora-junto-a-giufeder","title":"Seguimos integrando herramientas para una mejor gestión de redes:ahora junto a Giufeder","date":"2026-08-25","excerpt":"La operación de un ISP no termina en la gestión comercial. Con la integración entre anatod y Giufeder, conectamos tu plataforma de gestión con un sistema GIS especializado para que tu red, tu operación y tus decisiones trabajen en conjunto. Más control, más eficiencia y una visión completa de tu infraestructura.","content_html":"\n<p class=\"wp-block-paragraph\">En <strong>anatod</strong> ® seguimos ampliando nuestro ecosistema de integraciones.</p>\n\n\n\n<p class=\"wp-block-paragraph\">Nos alegra anunciar nuestra integración con <strong>Giufeder</strong>, empresa especializada en el desarrollo de soluciones para redes de telecomunicaciones y creadora de una plataforma <strong>GIS</strong> para el mapeo y la gestión de redes de fibra óptica.</p>\n\n\n\n<p class=\"wp-block-paragraph\">Gracias a esta integración, la información de la red física y la gestión comercial trabajan de forma unificada, permitiendo que la operación sea más eficiente y que cada área cuente con la información que necesita en el momento adecuado.</p>\n\n\n\n<p class=\"wp-block-paragraph\">La plataforma de Giufeder permite visualizar la infraestructura de fibra óptica, documentar la red, detectar posibles incidencias y facilitar el análisis para prevenir fallas antes de que impacten en los clientes.</p>\n\n\n\n<p class=\"wp-block-paragraph\">Integrada con <strong>anatod</strong> ®, esta información pasa a formar parte del día a día de la operación, ayudando a reducir tiempos, mejorar la coordinación entre equipos y tomar decisiones con mayor rapidez.</p>\n\n\n\n<p class=\"wp-block-paragraph\">Creemos que el futuro de los operadores de telecomunicaciones está en la integración entre plataformas especializadas. Por eso seguimos incorporando herramientas que potencian el trabajo de nuestros clientes, permitiéndoles gestionar toda su operación desde un ecosistema cada vez más conectado.</p>\n\n\n\n<p class=\"wp-block-paragraph\">Porque una red inteligente comienza con sistemas que trabajan juntos.</p>\n\n\n\n<p class=\"wp-block-paragraph\"><a href=\"https://giufeder.com/\"target=\"_blank\"rel=\"noopener noreferrer\">https://giufeder.com/</a></p>\n","image":{"url":"/assets/img/blog/2026/08/giufeder.jpg","alt":"giufeder"},"id":100082},{"slug":"11-anos-de-anatod","title":"11 años de anatod","date":"2026-08-01","excerpt":"Hoy anatod cumple 11 años.","content_html":"\n<p class=\"wp-block-paragraph\">Cuando empecé este proyecto, allá por 2015, tenía una idea muy clara:construir una plataforma que realmente ayudara a los ISP a crecer y les permitiera gestionar toda su operación desde un solo lugar.</p>\n\n\n\n<p class=\"wp-block-paragraph\">Con el tiempo entendí que no se trataba solo de desarrollar software. Se trataba de acompañar negocios que brindan un servicio esencial y que no pueden detenerse.</p>\n\n\n\n<p class=\"wp-block-paragraph\">Once años después, esa idea sigue siendo la misma. La diferencia es que hoy somos un equipo que continúa evolucionando la plataforma todos los días, incorporando nuevas integraciones, fortaleciendo la infraestructura, mejorando la seguridad y escuchando a cada cliente para seguir creciendo juntos.</p>\n\n\n\n<p class=\"wp-block-paragraph\">Mirando hacia atrás, hubo muchísimos desafíos, aprendizajes y kilómetros recorridos. Mirando hacia adelante, hay todavía más proyectos, ideas y objetivos por cumplir.</p>\n\n\n\n<p class=\"wp-block-paragraph\">Gracias a cada cliente, partner y amigo que confió en nosotros durante estos 11 años.</p>\n\n\n\n<p class=\"wp-block-paragraph\">Recién estamos empezando.</p>\n\n\n\n<p class=\"wp-block-paragraph\"><strong>¡Vamos por muchos años más!</strong> 🚀</p>\n","image":{"url":"/assets/img/blog/2026/08/anatod_11.jpg","alt":"anatod_11"},"id":100081},{"slug":"mas-seguridad-para-tu-isp-ahora-tambien-con-passkeys","title":"Más seguridad para tu ISP:ahora también con Passkeys","date":"2026-07-29","excerpt":"La seguridad evoluciona, y nosotros también. En anatod ® incorporamos autenticación mediante Passkeys, permitiendo acceder con huella digital, reconocimiento facial o el método biométrico de tu dispositivo.","content_html":"\n<p class=\"wp-block-paragraph\">En <strong>anatod</strong> ®seguimos incorporando herramientas para proteger uno de los activos más importantes de cualquier ISP:el acceso a su plataforma de gestión.</p>\n\n\n\n<p class=\"wp-block-paragraph\">A partir de ahora, nuestra plataforma incorpora <strong>autenticación mediante Passkeys</strong>, una tecnología que permite iniciar sesión utilizando la biometría del dispositivo, como la huella digital, el reconocimiento facial o el método de desbloqueo seguro de tu computadora o teléfono.</p>\n\n\n\n<p class=\"wp-block-paragraph\">Las Passkeys representan una nueva generación de autenticación. Eliminan la necesidad de recordar contraseñas complejas y reducen drásticamente el riesgo de robo de credenciales, ataques de phishing y reutilización de contraseñas.</p>\n\n\n\n<p class=\"wp-block-paragraph\">Esta nueva funcionalidad se suma a las múltiples capas de seguridad que ya ofrece <strong>anatod</strong> ®, entre ellas:</p>\n\n\n\n<ul class=\"wp-block-list\">\n<li>🔐 Autenticación en dos pasos (2FA).</li>\n\n\n\n<li>🌎 Restricción de acceso por direcciones IP autorizadas.</li>\n\n\n\n<li>🛡️ Controles avanzados de seguridad y monitoreo de accesos.</li>\n\n\n\n<li>👆 Inicio de sesión mediante <strong>Passkeys</strong> con biometría.</li>\n</ul>\n\n\n\n<p class=\"wp-block-paragraph\">La seguridad ya no depende únicamente de una contraseña. Con Passkeys, el acceso queda vinculado al dispositivo del usuario y protegido por los mecanismos de seguridad nativos de cada sistema operativo, ofreciendo una experiencia más rápida, cómoda y significativamente más segura.</p>\n\n\n\n<p class=\"wp-block-paragraph\">En <strong>anatod</strong> ®creemos que la ciberseguridad debe evolucionar al mismo ritmo que las amenazas. Por eso seguimos incorporando tecnologías modernas que ayudan a proteger la información de nuestros clientes y la operación diaria de cada ISP.</p>\n\n\n\n<p class=\"wp-block-paragraph\">Porque la seguridad no es una función más del sistema. Es la base sobre la que funciona todo.</p>\n","image":{"url":"/assets/img/blog/2026/07/anatod_passkey.jpg","alt":"anatod_passkey"},"id":100080},{"slug":"nueva-app-de-autogestion-tu-isp-con-tu-propia-identidad","title":"Nueva app de autogestión:tu ISP, con tu propia identidad","date":"2026-07-27","excerpt":"Presentamos la nueva web app de autogestión de anatod para Android y iOS. Colores, logo, imágenes y publicidad personalizados para que puedas ofrecer una experiencia digital completamente identificada con tu ISP.","content_html":"\n<p class=\"wp-block-paragraph\">En <strong>anatod</strong> ®seguimos mejorando la forma en que conectás con tus clientes. Por eso desarrollamos una nueva web app de autogestión, compatible con <strong>Android y iOS</strong>, con una experiencia moderna, rápida y completamente personalizada para tu ISP.</p>\n\n\n\n<p class=\"wp-block-paragraph\">Tus clientes pueden consultar sus servicios, realizar pagos, gestionar solicitudes y comunicarse con soporte desde un único lugar.</p>\n\n\n\n<p class=\"wp-block-paragraph\">Pero no queríamos crear una aplicación genérica.</p>\n\n\n\n<p class=\"wp-block-paragraph\">Personalizamos los colores, el logo, las imágenes y cada elemento visual para que tus clientes siempre reconozcan la identidad de tu empresa. También incorporamos un slider publicitario desde el que podés promocionar nuevos servicios, beneficios y novedades directamente dentro de la app.</p>\n\n\n\n<p class=\"wp-block-paragraph\">Así, la autogestión también se convierte en un nuevo canal comercial para tu ISP.</p>\n\n\n\n<p class=\"wp-block-paragraph\">Nosotros nos encargamos de adaptar toda la experiencia a tu marca. Vos ofrecés una aplicación moderna, simple y preparada para acompañar el crecimiento de tu operación.</p>\n\n\n\n<p class=\"wp-block-paragraph\"><strong>Tu marca. Tus servicios. Una experiencia de autogestión completamente personalizada.</strong></p>